{
  "schema_version": 1,
  "registry_id": "agent_toolcall_evidence_registry_v1",
  "purpose": "portable metadata pointers; original manifests and frozen evidence remain authoritative",
  "records": [
    {
      "record_id": "qwen25-3b-multiseed-gate-v7-v1-run",
      "run_id": "qwen25-3b-multiseed-gate-v7-v1-run",
      "protocol_id": "historical_gate_v7",
      "evidence_role": "qwen_locked_confirmatory_gate",
      "scientific_status": "complete",
      "manifest_sha256": "a46e2888f80e233faef216abec73adf44e9ddf7d0db33c31068dccbe39fb6663",
      "huggingface_remote_path": "datasets/BYFW123/quant-action-switch-runs/runs/qwen25-3b-multiseed-gate-v7-v1-run",
      "modelscope_remote_path": "datasets/ZHTODD/quant-action-switch-backup/runs/qwen25-3b-multiseed-gate-v7-v1-run",
      "restore_hint": "restore the manifested run directory from either verified dataset mirror",
      "registered_at": "2026-07-23T10:15:00Z",
      "frozen": true,
      "authoritative": true
    },
    {
      "record_id": "qwen25-3b-gptq4-full-seed-matrix-v1",
      "run_id": "qwen25-3b-gptq4-full-seed-matrix-v1",
      "protocol_id": "historical_gate_v7_post_hoc",
      "evidence_role": "gptq_full_seed_matrix_summary",
      "scientific_status": "post_hoc_gptq_full_seed_matrix_complete",
      "manifest_sha256": "0b8de720392742fa00231a2fb2a0b3aed31aee3703a378e4251a4c2646601b59",
      "huggingface_remote_path": "datasets/BYFW123/quant-action-switch-runs/runs/qwen25-3b-gptq4-full-seed-matrix-v1",
      "modelscope_remote_path": "datasets/ZHTODD/quant-action-switch-backup/runs/qwen25-3b-gptq4-full-seed-matrix-v1",
      "restore_hint": "restore the manifested derived run from either verified dataset mirror",
      "registered_at": "2026-07-23T10:15:00Z",
      "frozen": true,
      "authoritative": true
    },
    {
      "record_id": "qwen25-3b-nf4-gate-v7-posthoc-v1",
      "run_id": "qwen25-3b-nf4-gate-v7-posthoc-v1",
      "protocol_id": "historical_gate_v7_post_hoc",
      "evidence_role": "nf4_multiseed_summary",
      "scientific_status": "post_hoc_nf4_gate_v7_complete",
      "manifest_sha256": "9dde40d3fa41315972284d277347942dd267c7b91050848c074d1d51f211efab",
      "huggingface_remote_path": "datasets/BYFW123/quant-action-switch-runs/runs/qwen25-3b-nf4-gate-v7-posthoc-v1",
      "modelscope_remote_path": "datasets/ZHTODD/quant-action-switch-backup/runs/qwen25-3b-nf4-gate-v7-posthoc-v1",
      "restore_hint": "restore the manifested derived run from either verified dataset mirror",
      "registered_at": "2026-07-23T10:15:00Z",
      "frozen": true,
      "authoritative": true
    },
    {
      "record_id": "qwen25-3b-hqq4-gate-v7-multiseed-v1",
      "run_id": "qwen25-3b-hqq4-gate-v7-multiseed-v1",
      "protocol_id": "historical_gate_v7_post_hoc",
      "evidence_role": "hqq4_multiseed_summary",
      "scientific_status": "post_hoc_hqq4_gate_v7_complete",
      "manifest_sha256": "f89ce4ae0700bd554198d9b42c898503703473f1c634034673f3046e2705b51f",
      "huggingface_remote_path": "datasets/BYFW123/quant-action-switch-runs/runs/qwen25-3b-hqq4-gate-v7-multiseed-v1",
      "modelscope_remote_path": "datasets/ZHTODD/quant-action-switch-backup/runs/qwen25-3b-hqq4-gate-v7-multiseed-v1",
      "restore_hint": "restore the manifested derived run from either verified dataset mirror",
      "registered_at": "2026-07-23T10:15:00Z",
      "frozen": true,
      "authoritative": true
    },
    {
      "record_id": "qwen25-3b-gptq4-symbolic-defense-matrix-v1",
      "run_id": "qwen25-3b-gptq4-symbolic-defense-matrix-v1",
      "protocol_id": "historical_gate_v7_post_hoc",
      "evidence_role": "symbolic_policy_matrix",
      "scientific_status": "gptq_symbolic_defense_matrix_complete",
      "manifest_sha256": "9bce5318a5f01746b63484ba44ce33f4828f00bc899c193777a085b733124ae5",
      "huggingface_remote_path": "datasets/BYFW123/quant-action-switch-runs/runs/qwen25-3b-gptq4-symbolic-defense-matrix-v1",
      "modelscope_remote_path": "datasets/ZHTODD/quant-action-switch-backup/runs/qwen25-3b-gptq4-symbolic-defense-matrix-v1",
      "restore_hint": "restore the manifested symbolic-policy run from either verified dataset mirror",
      "registered_at": "2026-07-23T10:15:00Z",
      "frozen": true,
      "authoritative": false
    },
    {
      "record_id": "qwen25-symbolic-defense-controlled-summary-v1",
      "run_id": "qwen25-symbolic-defense-controlled-summary-v1",
      "protocol_id": "historical_gate_v7_post_hoc",
      "evidence_role": "symbolic_policy_controlled_summary",
      "scientific_status": "symbolic_defense_controlled_summary_complete",
      "manifest_sha256": "60104c0cd6cdc4e2725a29fdbfea2ad27a6a014e8e1bccbb311252f47495c819",
      "huggingface_remote_path": "datasets/BYFW123/quant-action-switch-runs/runs/qwen25-symbolic-defense-controlled-summary-v1",
      "modelscope_remote_path": "datasets/ZHTODD/quant-action-switch-backup/runs/qwen25-symbolic-defense-controlled-summary-v1",
      "restore_hint": "restore the manifested controlled summary from either verified dataset mirror",
      "registered_at": "2026-07-23T10:15:00Z",
      "frozen": true,
      "authoritative": false
    },
    {
      "record_id": "qwen25-mechanism-analysis-with-weight-deltas-v1",
      "run_id": "qwen25-mechanism-analysis-with-weight-deltas-v1",
      "protocol_id": "historical_gate_v7_post_hoc",
      "evidence_role": "mechanism_analysis_summary",
      "scientific_status": "mechanism_analysis_pack_complete",
      "manifest_sha256": "582a4df5194000cabe91807526ab1047bf5d967a49ac52b070d34f97c8583eb7",
      "huggingface_remote_path": "datasets/BYFW123/quant-action-switch-runs/runs/qwen25-mechanism-analysis-with-weight-deltas-v1",
      "modelscope_remote_path": "datasets/ZHTODD/quant-action-switch-backup/runs/qwen25-mechanism-analysis-with-weight-deltas-v1",
      "restore_hint": "restore the manifested mechanism-analysis run from either verified dataset mirror",
      "registered_at": "2026-07-23T10:15:00Z",
      "frozen": true,
      "authoritative": false
    },
    {
      "record_id": "gemma3-4b-layerdrop-benign-reconstruction-seed101-paper_equal_e2-v1-run",
      "run_id": "gemma3-4b-layerdrop-benign-reconstruction-seed101-paper_equal_e2-v1-run",
      "protocol_id": "historical_cross_family",
      "evidence_role": "gemma_cross_family_reconstruction_stop",
      "scientific_status": "reconstruction_gate_failed",
      "manifest_sha256": "2ea6dd26c02dcec95ef758fcf2048a290a7469d68eefd868508e5d27f62b07bb",
      "huggingface_remote_path": "datasets/BYFW123/quant-action-switch-runs/runs/gemma3-4b-layerdrop-benign-reconstruction-seed101-paper_equal_e2-v1-run",
      "modelscope_remote_path": "datasets/ZHTODD/quant-action-switch-backup/runs/gemma3-4b-layerdrop-benign-reconstruction-seed101-paper_equal_e2-v1-run",
      "restore_hint": "restore the manifested cross-family run and inspect its gate decision",
      "registered_at": "2026-07-23T10:15:00Z",
      "frozen": true,
      "authoritative": true
    },
    {
      "record_id": "gemma3-4b-layerdrop-benign-reconstruction-seed101-paper_equal_e4-v1-run",
      "run_id": "gemma3-4b-layerdrop-benign-reconstruction-seed101-paper_equal_e4-v1-run",
      "protocol_id": "historical_cross_family",
      "evidence_role": "gemma_cross_family_reconstruction_stop",
      "scientific_status": "reconstruction_gate_failed",
      "manifest_sha256": "f0a06b2499ff2f97cbb3ed93db26d8bfbe417bf5f0c1238cfe6a4444334ca4b1",
      "huggingface_remote_path": "datasets/BYFW123/quant-action-switch-runs/runs/gemma3-4b-layerdrop-benign-reconstruction-seed101-paper_equal_e4-v1-run",
      "modelscope_remote_path": "datasets/ZHTODD/quant-action-switch-backup/runs/gemma3-4b-layerdrop-benign-reconstruction-seed101-paper_equal_e4-v1-run",
      "restore_hint": "restore the manifested cross-family run and inspect its gate decision",
      "registered_at": "2026-07-23T10:15:00Z",
      "frozen": true,
      "authoritative": true
    },
    {
      "record_id": "llama32-3b-strict-seed101-run",
      "run_id": "llama32-3b-strict-seed101-run",
      "protocol_id": "historical_cross_family",
      "evidence_role": "llama_cross_family_reconstruction_stop",
      "scientific_status": "stopped_after_reconstruction_failure",
      "manifest_sha256": "a7e2465cff90f59fe61fe9d6a1549020d277e02a11c39954efdbee04cf67795a",
      "huggingface_remote_path": "datasets/BYFW123/quant-action-switch-runs/runs/llama32-3b-strict-seed101-run",
      "modelscope_remote_path": null,
      "restore_hint": "restore from the verified Hugging Face dataset path and inspect completion.json",
      "registered_at": "2026-07-23T10:15:00Z",
      "frozen": true,
      "authoritative": true
    }
  ]
}
